{"$schema":"https://json-schema.org/draft/2020-12/schema","$id":"https://gitoversight.com/schemas/approval.v1.json","title":"Exact human approval","type":"object","additionalProperties":false,"required":["schema_version","approval_id","source_repository","destination_repository","source_commit","export_tree","paths","metadata","operations","approver","expires_at","nonce"],"properties":{"schema_version":{"const":1},"approval_id":{"type":"string","minLength":1},"source_repository":{"type":"string","minLength":3},"destination_repository":{"type":"string","minLength":3},"source_commit":{"type":"string","minLength":7},"export_tree":{"type":"string","minLength":7},"paths":{"type":"array","minItems":1,"uniqueItems":true,"items":{"type":"string","minLength":1}},"metadata":{"type":"object","additionalProperties":false,"required":["title","body"],"properties":{"title":{"type":"string","minLength":1},"body":{"type":"string"}}},"operations":{"type":"array","minItems":1,"uniqueItems":true,"items":{"type":"string","minLength":1}},"approver":{"type":"string","minLength":1},"expires_at":{"type":"string","format":"date-time"},"nonce":{"type":"string","minLength":16}}}
