{"schema_version":1,"approval_id":"approval-001","source_repository":"yaniv256/gitoversight.test-public.dev","destination_repository":"yaniv256/gitoversight.test-public","source_commit":"1111111111111111111111111111111111111111","export_tree":"2222222222222222222222222222222222222222","paths":["README.md"],"metadata":{"title":"Publish reviewed fixture","body":"Exact reviewed fixture publication."},"operations":["branch.push","pull_request.create","pull_request.merge"],"approver":"yaniv256","expires_at":"2030-01-01T00:00:00Z","nonce":"nonce-001-abcdef"}
